{
	"$schema": "../../schema/mod-schema.json",
	"id": "bepinex-il2cpp-x86",
	"loaderId": "bepinex",
	"isLoader": true,
	"engine": "Unity",
	"architecture": "X86",
	"unityBackend": "Il2Cpp",
	"title": "BepInEx Il2Cpp X86",
	"author": "BepInEx",
	"sourceCode": "https://github.com/BepInEx/BepInEx",
	"description": "BepInEx bleeding-edge Il2Cpp build for X86 games.",
	"latestVersion": {
		"id": "6.0.0-be.755",
		"url": "https://builds.bepinex.dev/projects/bepinex_be/755/BepInEx-Unity.IL2CPP-win-x86-6.0.0-be.755%2B3fab71a.zip"
	}
}
