{
	"$schema": "../../schema/mod-schema.json",
	"id": "unity-explorer-mono",
	"loaderId": "bepinex",
	"engine": "Unity",
	"unityBackend": "Mono",
	"title": "UnityExplorer Mono",
	"author": "Sinai",
	"sourceCode": "https://github.com/sinai-dev/UnityExplorer",
	"description": "An in-game UI for exploring, debugging and modifying Unity games.",
	"latestVersion": {
		"id": "4.9.0",
		"url": "https://github.com/sinai-dev/UnityExplorer/releases/download/4.9.0/UnityExplorer.BepInEx5.Mono.zip"
	}
}
